{
  "pattern": "comparison",
  "title": "Debounce approaches compared",
  "lang": "en",
  "slots": {
    "APPROACHES_SECTION": "tradeoffTable"
  },
  "components": {
    "tradeoffTable": {
      "type": "tradeoff-table",
      "rows": [
        { "pro": "Simple, no deps", "con": "Logic duplicated" },
        { "pro": "Easy to debug", "con": "Two state sources" }
      ]
    }
  }
}
